<?xml version="1.0" encoding="UTF-8" ?>
<!DOCTYPE localeData SYSTEM "http://oss.software.ibm.com/cvs/icu/~checkout~/locale/LocaleElements.dtd" >
<localeData>
	<identity>
		<version number="1.0">Various notes and changes in version 1.0</version>
		<generation date="2003-01-10" />
		<language type="hr"></language>
	</identity>
	<localeDisplayNames>
		<languages>
			<language type="hr">hrvatski</language>
		</languages>
		<territories>
			<territory type="HR">Hrvatska</territory>
		</territories>
		<keys>
			<key type="collation">collation</key>
			<key type="calendar">calendar</key>
		</keys>
	</localeDisplayNames>
	<layout>
		<orientation lines="top-to-bottom" characters="left-to-right" />
	</layout>
		<dates>
			<localizedPatternChars>GanjkHmsSEDFwWxhKzZ</localizedPatternChars>
			<calendars>
				<default type="gregorian"/>
				<calendar type="gregorian">
					<monthNames>
						<month type="1">siječanj</month>
						<month type="2">veljača</month>
						<month type="3">ožujak</month>
						<month type="4">travanj</month>
						<month type="5">svibanj</month>
						<month type="6">lipanj</month>
						<month type="7">srpanj</month>
						<month type="8">kolovoz</month>
						<month type="9">rujan</month>
						<month type="10">listopad</month>
						<month type="11">studeni</month>
						<month type="12">prosinac</month>
						<month type="13"></month>
					</monthNames>
					<monthAbbr>
						<month type="1">sij</month>
						<month type="2">vel</month>
						<month type="3">ožu</month>
						<month type="4">tra</month>
						<month type="5">svi</month>
						<month type="6">lip</month>
						<month type="7">srp</month>
						<month type="8">kol</month>
						<month type="9">ruj</month>
						<month type="10">lis</month>
						<month type="11">stu</month>
						<month type="12">pro</month>
						<month type="13"></month>
					</monthAbbr>
					<dayNames>
						<day type="sun">nedjelja</day>
						<day type="mon">ponedjeljak</day>
						<day type="tue">utorak</day>
						<day type="wed">srijeda</day>
						<day type="thu">četvrtak</day>
						<day type="fri">petak</day>
						<day type="sat">subota</day>
					</dayNames>
					<dayAbbr>
						<day type="sun">ned</day>
						<day type="mon">pon</day>
						<day type="tue">uto</day>
						<day type="wed">sri</day>
						<day type="thu">čet</day>
						<day type="fri">pet</day>
						<day type="sat">sub</day>
					</dayAbbr>
					<dateFormats>
						<default type="medium"/>
						<dateFormat type="full">
							<pattern>yyyy. MMMM dd</pattern>
						</dateFormat>
						<dateFormat type="long">
							<pattern>yyyy. MMMM dd</pattern>
						</dateFormat>
						<dateFormat type="medium">
							<pattern>yyyy.MM.dd</pattern>
						</dateFormat>
						<dateFormat type="short">
							<pattern>yyyy.MM.dd</pattern>
						</dateFormat>
					</dateFormats>
					<timeFormats>
						<default type="medium"/>
						<timeFormat type="full">
							<pattern>HH:mm:ss z</pattern>
						</timeFormat>
						<timeFormat type="long">
							<pattern>HH:mm:ss z</pattern>
						</timeFormat>
						<timeFormat type="medium">
							<pattern>HH:mm:ss</pattern>
						</timeFormat>
						<timeFormat type="short">
							<pattern>HH:mm</pattern>
						</timeFormat>
					</timeFormats>
					<dateTimeFormat>
						<pattern>{1} {0}</pattern>
					</dateTimeFormat>
				</calendar>
			</calendars>
		</dates>
			<collations>
				<collation  >
					<rules>
						<reset></reset>
						<i>̌</i>
						<reset>̆</reset>
						<i>̍</i>
						<reset>C</reset>
						<p>č</p>
						<t>Č</t>
						<p>ć</p>
						<t>Ć</t>
						<reset>D</reset>
						<p>ǳ</p>
						<tc>ǲǱ</tc>
						<p>dz</p>
						<tc>dZDzDZ</tc>
						<p>ǆ</p>
						<tc>ǅǄ</tc>
						<p>đ</p>
						<t>Đ</t>
						<reset>L</reset>
						<p>lj</p>
						<tc>lJLjLJ</tc>
						<reset>N</reset>
						<p>nj</p>
						<tc>nJNjNJ</tc>
						<reset>S</reset>
						<p>š</p>
						<t>Š</t>
						<reset>Z</reset>
						<p>ž</p>
					</rules>
					<special owner="http://oss.software.ibm.com/icu/" version="1.0" />
				</collation  >
			</collations>
</localeData>
